{
  "schema_version": "0.1.0",
  "dataset_name": "MAI Abu Dhabi Opportunity Graph",
  "last_updated": "2026-10-02",
  "principles": [
    "Evidence, Not Guessing.",
    "OpenAI extracts and explains; the Opportunity Graph retrieves; MAI evaluates evidence, uncertainty, gaps, and next responsible action.",
    "Possibilities are exploration paths, not predictions, rankings, or recommendations.",
    "Critical missing information should trigger questions rather than invented conclusions."
  ],
  "pathways": [
    "Career",
    "Career Change",
    "Business",
    "Investment",
    "Education",
    "Family",
    "New Life"
  ],
  "evidence_status_legend": {
    "verified": "The source is official or primary and was checked for this dataset build.",
    "partial": "The source supports the broad opportunity, but user-specific eligibility or current availability still requires verification.",
    "needs_update": "The source is official but time-sensitive, older, or likely to change before a user acts.",
    "missing": "A needed claim has no source yet and must not be presented as established fact."
  },
  "opportunities": [
    {
      "opportunity_id": "opp-ai-startup-founder-hub71-ai",
      "title": "AI startup founder pathway through Hub71+ AI",
      "pathways": [
        "Business",
        "Career Change"
      ],
      "capability_match": {
        "best_fit_user_signals": [
          "Founder or operator building an AI product",
          "Technical AI, ML, software, data, or product background",
          "Interest in scaling through Abu Dhabi rather than only finding a job"
        ],
        "circumstances_that_help": [
          "Existing MVP, pilot customers, or strong founding team",
          "Willingness for at least one founder to spend meaningful time in Abu Dhabi",
          "Product can benefit from AI infrastructure, R&D links, or enterprise/government partners"
        ],
        "circumstances_that_block_or_slow": [
          "No product concept or team yet",
          "Regulated sector without compliance plan",
          "Cannot establish Abu Dhabi presence if accepted"
        ]
      },
      "transferable_capabilities": [
        {
          "capability": "AI product building",
          "from_user_signal": "Has built models, data products, automation systems, or AI-enabled workflows",
          "how_it_transfers": "Can become the core capability of a startup eligible for an AI-focused ecosystem rather than only a salaried role"
        },
        {
          "capability": "Enterprise problem solving",
          "from_user_signal": "Has solved operational problems for companies or institutions",
          "how_it_transfers": "Can map into cross-sector AI use cases that Abu Dhabi ecosystem partners may want to test"
        }
      ],
      "abu_dhabi_opportunity": {
        "description": "Explore whether the user's AI product or founding profile fits the Hub71+ AI specialist ecosystem and related Abu Dhabi AI partners.",
        "sector": "Artificial Intelligence / Startups",
        "relevant_entities": [
          "Hub71",
          "Hub71+ AI",
          "ADGM",
          "AI71",
          "Core42",
          "MBZUAI"
        ]
      },
      "why_this_matters_in_abu_dhabi": "Abu Dhabi has a visible AI startup ecosystem push through Hub71+ AI and partners providing infrastructure, talent access, and R&D links; this creates an exploration path for builders, not just job seekers.",
      "evidence_refs": [
        {
          "evidence_id": "ev-hub71-ai-launch",
          "claim": "Hub71 launched Hub71+ AI as a specialist ecosystem for startups harnessing cross-sector AI innovation, backed by partners including Core42, AI71, AWS, Google for Startups, Nvidia, HPE, MBZUAI, and 42 Abu Dhabi.",
          "source_name": "Hub71 press release",
          "source_url": "https://www.hub71.com/latest-news/press-release/abu-dhabi-launches-hub71-plus-ai-to-advance-startups-driving-ai-innovation",
          "date_checked": "2026-10-02",
          "evidence_status": "verified",
          "evidence_summary": "Official Hub71 source confirms the specialist AI ecosystem and partner network."
        },
        {
          "evidence_id": "ev-hub71-faq-relocation",
          "claim": "Hub71 states accepted startups must relocate and establish a presence at Hub71, and it encourages at least one founder to relocate for the programme duration.",
          "source_name": "Hub71 FAQ",
          "source_url": "https://www.hub71.com/faqs",
          "date_checked": "2026-10-02",
          "evidence_status": "verified",
          "evidence_summary": "Official FAQ supports the relocation/presence requirement that affects user fit."
        }
      ],
      "missing_evidence": [
        "Current Hub71+ AI cohort application deadline and eligibility details for this exact user",
        "Whether the user's startup stage, sector, and traction satisfy Hub71 selection criteria",
        "Whether any regulated AI use case needs additional approvals"
      ],
      "uncertainty_level": "medium",
      "gap_questions": [
        "Do you already have an AI product, MVP, customers, pilots, or only an idea?",
        "Could one founder relocate or spend the required programme time in Abu Dhabi?",
        "Is the product in a regulated field such as finance, health, education, or public sector decisioning?"
      ],
      "what_would_change_assessment": [
        "A confirmed active application window would increase actionability.",
        "Evidence of product traction or a credible founding team would strengthen fit.",
        "A regulated use case without compliance planning would increase uncertainty."
      ],
      "next_responsible_action": "Check the current Hub71+ AI application route and prepare a one-page fit memo mapping product, traction, founder availability, and regulatory exposure.",
      "demo_classification_hints": {
        "your_request_when": "User explicitly asks about launching or scaling an AI startup in Abu Dhabi.",
        "other_possibility_when": "User asks for AI jobs but has founder-level product, technical, or market-building capability."
      },
      "guardrails": [
        "Do not present admission, funding, or visa outcomes as likely.",
        "Do not invent cohort deadlines; verify before action."
      ]
    },
    {
      "opportunity_id": "opp-preseed-startup-founder-hub71-access",
      "title": "Pre-seed to Series A startup pathway through Hub71 Access",
      "pathways": [
        "Business"
      ],
      "capability_match": {
        "best_fit_user_signals": [
          "Startup founder with pitch deck, team, and early traction",
          "Product can use Abu Dhabi market, capital, talent, or corporate access",
          "Wants a structured market-entry programme"
        ],
        "circumstances_that_help": [
          "Clear problem, solution, value proposition, and business model",
          "Raised capital, pilots, revenue, or validated demand",
          "Long-term Abu Dhabi team-building plan"
        ],
        "circumstances_that_block_or_slow": [
          "No pitch deck or business model",
          "No founder able to relocate",
          "Business activity incompatible with Abu Dhabi licensing or regulatory requirements"
        ]
      },
      "transferable_capabilities": [
        {
          "capability": "Startup execution",
          "from_user_signal": "Has built a product, hired a team, raised funds, or acquired customers",
          "how_it_transfers": "Can be evaluated against Hub71 programme selection criteria instead of only general business setup"
        },
        {
          "capability": "Market expansion",
          "from_user_signal": "Wants MENA, UAE, or government/corporate market access",
          "how_it_transfers": "Can align with Hub71's stated market, capital, and partner access proposition"
        }
      ],
      "abu_dhabi_opportunity": {
        "description": "Assess whether an established startup can apply to Hub71 Access for Abu Dhabi market entry, incentives, partner access, and founder relocation.",
        "sector": "Startups / Market Entry",
        "relevant_entities": [
          "Hub71",
          "ADGM",
          "Techstars"
        ]
      },
      "why_this_matters_in_abu_dhabi": "Hub71 Access is positioned as a route into Abu Dhabi's marketplace for pre-seed to Series A startups, giving the user a concrete exploration track if they are already building a company.",
      "evidence_refs": [
        {
          "evidence_id": "ev-hub71-access-programme",
          "claim": "Hub71 Access is described as a 12-month programme for pre-seed to Series A startups, with in-kind incentives, cash for equity, partner access, and an expectation that at least one founder moves to Abu Dhabi.",
          "source_name": "Hub71 Access Programme",
          "source_url": "https://www.hub71.com/index.php/program/access-programme",
          "date_checked": "2026-10-02",
          "evidence_status": "verified",
          "evidence_summary": "Official programme page supports stage, relocation, incentive, and application-preparation fields."
        }
      ],
      "missing_evidence": [
        "Current application cycle details for the user's intended date",
        "Whether the user's sector is preferred or excluded",
        "Exact equity and incentive terms at time of application"
      ],
      "uncertainty_level": "medium",
      "gap_questions": [
        "What stage is the company: idea, MVP, revenue, pre-seed, seed, or Series A?",
        "Do you have a pitch deck covering problem, solution, business model, market, traction, and team?",
        "Can one founder commit to Abu Dhabi presence if accepted?"
      ],
      "what_would_change_assessment": [
        "A complete pitch deck and traction evidence would make this more actionable.",
        "No founder relocation availability would weaken fit.",